=== SLURM JOB SUMMARY ===
Job ID:        152942
Job Name:      runsh_cpu_full
Partition:     longer_mdbf
Node(s):       cn20
Exclusive:     yes
Mem request:   all-node (--mem=0)

=== SLURM NODE DETAIL (scheduler view) ===
NodeName=cn20
CoresPerSocket=16
CPUTot=32
RealMemory=232098
Sockets=2
ThreadsPerCore=1

=== OS VIEW (on allocated node) ===
Architecture:        x86_64
CPU op-mode(s):      32-bit, 64-bit
Byte Order:          Little Endian
CPU(s):              32
On-line CPU(s) list: 0-31
Thread(s) per core:  1
Core(s) per socket:  16
Socket(s):           2
NUMA node(s):        1
Vendor ID:           GenuineIntel
CPU family:          6
Model:               85
Model name:          Intel(R) Xeon(R) Gold 6130 CPU @ 2.10GHz
Stepping:            4
CPU MHz:             2100.000
CPU max MHz:         3700.0000
CPU min MHz:         1000.0000
BogoMIPS:            4200.00
L1d cache:           32K
L1i cache:           32K
L2 cache:            1024K
L3 cache:            22528K
NUMA node0 CPU(s):   0-31
Flags:               fpu vme de pse tsc msr pae mce cx8 apic sep mtrr pge mca cmov pat pse36 clflush dts acpi mmx fxsr sse sse2 ss ht tm pbe syscall nx pdpe1gb rdtscp lm constant_tsc art arch_perfmon pebs bts rep_good nopl xtopology nonstop_tsc cpuid aperfmperf pni pclmulqdq dtes64 monitor ds_cpl smx est tm2 ssse3 sdbg fma cx16 xtpr pdcm pcid dca sse4_1 sse4_2 x2apic movbe popcnt tsc_deadline_timer aes xsave avx f16c rdrand lahf_lm abm 3dnowprefetch cpuid_fault epb cat_l3 cdp_l3 invpcid_single pti intel_ppin ssbd mba ibrs ibpb stibp fsgsbase tsc_adjust bmi1 hle avx2 smep bmi2 erms invpcid rtm cqm mpx rdt_a avx512f avx512dq rdseed adx smap clflushopt clwb intel_pt avx512cd avx512bw avx512vl xsaveopt xsavec xgetbv1 xsaves cqm_llc cqm_occup_llc cqm_mbm_total cqm_mbm_local dtherm ida arat pln pts hwp hwp_act_window hwp_pkg_req pku ospke md_clear flush_l1d arch_capabilities

              total        used        free      shared  buff/cache   available
Mem:          251Gi       1.5Gi       238Gi        11Gi        12Gi       236Gi
Swap:            0B          0B          0B

available: 1 nodes (0)
node 0 cpus: 0 1 2 3 4 5 6 7 8 9 10 11 12 13 14 15 16 17 18 19 20 21 22 23 24 25 26 27 28 29 30 31
node 0 size: 257581 MB
node 0 free: 243759 MB
node distances:
node   0 
  0:  10 

[INFO] SLURM job 152942 starting on cn20 at Sun Nov 30 10:24:44 +03 2025
[INFO] Launching run.sh with index 9 using 31 CPU threads
[INFO] Project root: /cta/users/erhun.kundakcioglu/TVCommercialScheduling
[INFO] Command index: 9
[INFO] Command file: commands/run_commands_9.txt
[INFO] Base Python: /cta/capps/python/3.11.7/gcc/13.2.0/drtq5ks/bin/python3
[INFO] Virtualenv directory: /tmp/venv_erhun.kundakcioglu_152942_9
[INFO] Creating virtualenv...
[INFO] Using Python from venv: /tmp/venv_erhun.kundakcioglu_152942_9/bin/python
[INFO] Installing dependencies from requirements.txt...
Collecting PyYAML==6.0.3 (from -r /cta/users/erhun.kundakcioglu/TVCommercialScheduling/requirements.txt (line 1))
  Using cached pyyaml-6.0.3-cp311-cp311-manylinux2014_x86_64.manylinux_2_17_x86_64.manylinux_2_28_x86_64.whl.metadata (2.4 kB)
Using cached pyyaml-6.0.3-cp311-cp311-manylinux2014_x86_64.manylinux_2_17_x86_64.manylinux_2_28_x86_64.whl (806 kB)
Installing collected packages: PyYAML
Successfully installed PyYAML-6.0.3
[INFO] Running: python run.py "commands/run_commands_9.txt"
Starting execution of 33 commands...

[1/33] Starting command 1...
Executing: ./gradlew runMipSolver -PinstancePath="instances/density=MEDIUM_nInventory=20_nHours=5_seed=3.json" -PoutputPath="November2/continuous" -PmodelType="Continuous" -PcheckPointTimes="30,60,120,300,600,900,1800,3600,7200" -PlogPath="November2/continuous/density=MEDIUM_nInventory=20_nHours=5_seed=3.json/mip.log"
Command failed with return code: 1
Error: 
FAILURE: Build failed with an exception.

* What went wrong:
Execution failed for task ':runMipSolver'.
> Process 'command '/cta/users/erhun.kundakcioglu/jdk-21.0.3+9/bin/java'' finished with non-zero exit value 1

* Try:
> Run with --stacktrace option to get the stack trace.
> Run with --info or --debug option to get more log output.
> Run with --scan to get full insights.
> Get more help at https://help.gradle.org.

BUİLD FAILED in 15m 15s

Starting a Gradle Daemon, 5 busy and 2 incompatible and 3 stopped Daemons could not be reused, use --status for details
> Task :compileJava UP-TO-DATE
> Task :processResources NO-SOURCE
> Task :classes UP-TO-DATE

> Task :runMipSolver
Running MIP Solver with arguments: --instancePath=instances/density=MEDIUM_nInventory=20_nHours=5_seed=3.json --outputPath=November2/continuous --modelType=Continuous --checkPointTimes=30,60,120,300,600,900,1800,3600,7200 --logPath=November2/continuous/density=MEDIUM_nInventory=20_nHours=5_seed=3.json/mip.log
Loading problem instance...
Set parameter WLSAccessID
Set parameter WLSSecret
Set parameter LicenseID to value 2736771
Academic license 2736771 - for non-commercial use only - registered to er___@sabanciuniv.edu
Warning: Gurobi version mismatch between Java 12.0.0 and C library 12.0.3
Set parameter SoftMemLimit to value 120
Set parameter TimeLimit to value 30
Gurobi Optimizer version 12.0.3 build v12.0.3rc0 (linux64)

CPU model: Intel(R) Xeon(R) Gold 6130 CPU @ 2.10GHz, instruction set [SSE2|AVX|AVX2|AVX512]
Thread count: 32 physical cores, 32 logical processors, using up to 32 threads

Non-default parameters:
TimeLimit  30
SoftMemLimit  120

Academic license 2736771 - for non-commercial use only - registered to er___@sabanciuniv.edu
Optimize a model with 32811 rows, 18706 columns and 3715730 nonzeros
Model fingerprint: 0x618c6813
Variable types: 8460 continuous, 10246 integer (10246 binary)
Coefficient statistics:
  Matrix range     [1e+00, 2e+05]
  Objective range  [9e+01, 5e+04]
  Bounds range     [1e+00, 1e+00]
  RHS range        [1e+00, 2e+05]
Found heuristic solution: objective -0.0000000
Presolve removed 3459 rows and 726 columns (presolve time = 5s)...
Presolve removed 3579 rows and 726 columns (presolve time = 10s)...
Presolve removed 3597 rows and 726 columns (presolve time = 17s)...
Presolve removed 4822 rows and 1934 columns (presolve time = 20s)...
Presolve added 0 rows and 203 columns
Presolve removed 2686 rows and 0 columns
Presolve time: 23.85s
Presolved: 30125 rows, 18909 columns, 1294527 nonzeros
Variable types: 7600 continuous, 11309 integer (10056 binary)
Deterministic concurrent LP optimizer: primal and dual simplex
Showing primal log only...


Root simplex log...

Iteration    Objective       Primal Inf.    Dual Inf.      Time
       0   -0.0000000e+00   0.000000e+00   5.477031e+05     25s
Concurrent spin time: 0.00s

Solved with dual simplex

Root simplex log...

Iteration    Objective       Primal Inf.    Dual Inf.      Time
   21759    4.6443035e+06   0.000000e+00   0.000000e+00     30s

Root relaxation: objective 4.644303e+06, 21759 iterations, 5.00 seconds (6.77 work units)

    Nodes    |    Current Node    |     Objective Bounds      |     Work
 Expl Unexpl |  Obj  Depth IntInf | Incumbent    BestBd   Gap | It/Node Time

     0     0 4644303.48    0 3315   -0.00000 4644303.48      -     -   30s

Explored 1 nodes (22663 simplex iterations) in 30.02 seconds (27.05 work units)
Thread count was 32 (of 32 available processors)

Solution count 1: -0 

Time limit reached
Best objective -0.000000000000e+00, best bound 4.644303484921e+06, gap -
Set parameter TimeLimit to value 30
Gurobi Optimizer version 12.0.3 build v12.0.3rc0 (linux64)

CPU model: Intel(R) Xeon(R) Gold 6130 CPU @ 2.10GHz, instruction set [SSE2|AVX|AVX2|AVX512]
Thread count: 32 physical cores, 32 logical processors, using up to 32 threads

Non-default parameters:
TimeLimit  30
SoftMemLimit  120

Academic license 2736771 - for non-commercial use only - registered to er___@sabanciuniv.edu
Optimize a model with 32811 rows, 18706 columns and 3715730 nonzeros
Model fingerprint: 0x618c6813
Variable types: 8460 continuous, 10246 integer (10246 binary)
Coefficient statistics:
  Matrix range     [1e+00, 2e+05]
  Objective range  [9e+01, 5e+04]
  Bounds range     [1e+00, 1e+00]
  RHS range        [1e+00, 2e+05]
Presolved: 30125 rows, 18909 columns, 1294527 nonzeros

Continuing optimization...

     0     0 4644303.48    0 3191   -0.00000 4644303.48      -     -   39s
H    0     0                    222485.47992 4644303.48  1987%     -   40s
H    0     0                    232257.95333 4644303.48  1900%     -   40s
H    0     0                    233872.80205 4644303.48  1886%     -   40s
H    0     0                    240311.39369 4644303.48  1833%     -   40s
H    0     0                    247174.66707 4644303.48  1779%     -   40s
H    0     0                    262050.69651 4644303.48  1672%     -   40s
H    0     0                    361115.33512 4644303.48  1186%     -   40s
H    0     0                    361395.63672 4644303.48  1185%     -   40s
H    0     0                    370053.60124 4644303.48  1155%     -   40s
H    0     0                    384221.73353 4644303.48  1109%     -   40s
H    0     0                    386199.83034 4644303.48  1103%     -   40s
H    0     0                    396584.09852 4644303.48  1071%     -   40s
H    0     0                    398218.65926 4644303.48  1066%     -   40s
H    0     0                    401232.88605 4644303.48  1058%     -   40s
H    0     0                    401433.98526 4644303.48  1057%     -   40s
H    0     0                    404211.47444 4644303.48  1049%     -   40s
H    0     0                    438328.28689 4644303.48   960%     -   40s
     0     0 4644303.48    0 3191 438328.287 4644303.48   960%     -   42s
H    0     0                    442873.08098 4634990.74   947%     -   42s
     0     0 3930617.01    0 3128 442873.081 3930617.01   788%     -   52s
     0     0 3589781.55    0 3044 442873.081 3589781.55   711%     -   56s
     0     0 3481950.66    0 2981 442873.081 3481950.66   686%     -   59s
     0     0          -    0      442873.081 3481950.66   686%     -   60s

Cutting planes:
  Learned: 1
  Gomory: 59
  Cover: 157
  Implied bound: 103
  Clique: 37
  MIR: 189
  Flow cover: 801
  GUB cover: 150
  RLT: 5

Explored 1 nodes (81078 simplex iterations) in 30.04 seconds (39.83 work units)
Thread count was 32 (of 32 available processors)

Solution count 10: 442873 438328 404211 ... 370054

Time limit reached
Best objective 4.428730809818e+05, best bound 3.481950664586e+06, gap 686.2186%
Set parameter TimeLimit to value 60
Gurobi Optimizer version 12.0.3 build v12.0.3rc0 (linux64)

CPU model: Intel(R) Xeon(R) Gold 6130 CPU @ 2.10GHz, instruction set [SSE2|AVX|AVX2|AVX512]
Thread count: 32 physical cores, 32 logical processors, using up to 32 threads

Non-default parameters:
TimeLimit  60
SoftMemLimit  120

Academic license 2736771 - for non-commercial use only - registered to er___@sabanciuniv.edu
Optimize a model with 32811 rows, 18706 columns and 3715730 nonzeros
Model fingerprint: 0x618c6813
Variable types: 8460 continuous, 10246 integer (10246 binary)
Coefficient statistics:
  Matrix range     [1e+00, 2e+05]
  Objective range  [9e+01, 5e+04]
  Bounds range     [1e+00, 1e+00]
  RHS range        [1e+00, 2e+05]
Presolved: 30125 rows, 18909 columns, 1294527 nonzeros

Continuing optimization...

     0     0 3460525.13    0 2887 442873.081 3460525.13   681%     -   72s
H    0     0                    566146.29244 3460525.13   511%     -   73s
H    0     0                    567352.92701 3460525.13   510%     -   73s
H    0     0                    632561.85788 3460525.13   447%     -   73s
H    0     0                    640851.01520 3460525.13   440%     -   73s
     0     0 3458137.56    0 2928 640851.015 3458137.56   440%     -   74s
     0     0 3456338.68    0 2911 640851.015 3456338.68   439%     -   74s
     0     0 3456317.68    0 2911 640851.015 3456317.68   439%     -   75s
     0     0 3456317.68    0 2857 640851.015 3456317.68   439%     -   84s
H    0     0                    672087.12966 3456317.68   414%     -   85s
H    0     0                    672541.63887 3456317.68   414%     -   86s
H    0     0                    675773.13237 3456317.68   411%     -   86s
H    0     0                    709241.18180 3456095.74   387%     -   88s
H    0     0                    709688.76440 3456095.74   387%     -   88s
H    0     0                    710360.72412 3456095.74   387%     -   88s
H    0     0                    711367.71115 3456095.74   386%     -   88s
H    0     0                    725868.28049 3456095.74   376%     -   89s
H    0     0                    727259.73543 3456095.74   375%     -   89s
H    0     0                    742353.62237 3456095.74   366%     -   89s
H    0     0                    783237.94230 3456095.74   341%     -   90s
H    0     0                    793826.23004 3456095.74   335%     -   90s
H    0     0                    825186.60047 3456095.74   319%     -   90s
H    0     0                    848495.99203 3456095.74   307%     -   90s
H    0     0                    863150.09428 3456095.74   300%     -   90s
H    0     0                    900263.08113 3456095.74   284%     -   91s
H    0     0                    903376.60317 3456095.74   283%     -   91s
H    0     0                    922412.46751 3456095.74   275%     -   92s
H    0     0                    925529.83451 3456095.74   273%     -   93s
H    0     0                    926391.64123 3456095.74   273%     -   93s
H    0     0                    926857.95552 3456095.74   273%     -   93s
H    0     0                    928835.42941 3456095.74   272%     -   93s
H    0     0                    932876.00108 3456095.74   270%     -   93s
H    0     0                    937333.03913 3456095.74   269%     -   93s
H    0     0                    944493.22947 3456095.74   266%     -   93s
H    0     2                    946942.95357 3456095.74   265%     -   98s
     0     2 3456095.74    0 2824 946942.954 3456095.74   265%     -   98s
     1     4 3429141.14    1 2822 946942.954 3456095.74   265%  2435   98s
     3     7 2945482.63    2 2926 946942.954 3435308.09   263%  3278  103s
    14    16 2859239.01    4 2920 946942.954 2957074.51   212%  3030  107s
    23    24 2825421.81    5 2947 946942.954 2859239.01   202%  4592  113s

Cutting planes:
  Learned: 318
  Gomory: 71
  Cover: 649
  Implied bound: 727
  Clique: 139
  MIR: 673
  StrongCG: 5
  Flow cover: 1176
  GUB cover: 247
  Zero half: 38
  RLT: 88
  Relax-and-lift: 23
  BQP: 2

Explored 39 nodes (304628 simplex iterations) in 60.07 seconds (79.18 work units)
Thread count was 32 (of 32 available processors)

Solution count 10: 946943 944493 937333 ... 903377

Time limit reached
Best objective 9.469429535666e+05, best bound 2.842558998087e+06, gap 200.1827%
Set parameter TimeLimit to value 180
Gurobi Optimizer version 12.0.3 build v12.0.3rc0 (linux64)

CPU model: Intel(R) Xeon(R) Gold 6130 CPU @ 2.10GHz, instruction set [SSE2|AVX|AVX2|AVX512]
Thread count: 32 physical cores, 32 logical processors, using up to 32 threads

Non-default parameters:
TimeLimit  180
SoftMemLimit  120

Academic license 2736771 - for non-commercial use only - registered to er___@sabanciuniv.edu
Optimize a model with 32811 rows, 18706 columns and 3715730 nonzeros
Model fingerprint: 0x618c6813
Variable types: 8460 continuous, 10246 integer (10246 binary)
Coefficient statistics:
  Matrix range     [1e+00, 2e+05]
  Objective range  [9e+01, 5e+04]
  Bounds range     [1e+00, 1e+00]
  RHS range        [1e+00, 2e+05]
Presolved: 30125 rows, 18909 columns, 1294527 nonzeros

Continuing optimization...

H   39    44                    968255.82352 2842559.00   194%  4156  128s
    39    44 2838281.23    6 2972 968255.824 2842439.21   194%  4633  128s
H   40    44                    968288.00285 2842439.21   194%  4517  128s
H   41    44                    970599.26572 2841343.20   193%  4893  128s
H   41    44                    1013848.3758 2841343.20   180%  4893  128s
H   43    44                    1018847.4452 2838281.23   179%  5039  128s
H   44    44                    1020196.8452 2838281.23   178%  5033  128s
H   47    44                    1024766.2487 2838281.23   177%  5265  128s
H   49    44                    1027067.2530 2838281.23   176%  5754  128s
    63    71 2836273.68    7 3000 1027067.25 2837741.70   176%  6732  138s
H   95   200                    1043536.6540 2836273.68   172%  5401  145s
H  100   200                    1055228.5180 2836273.68   169%  5160  145s
H  110   200                    1063801.7220 2836273.68   167%  4733  145s
H  120   200                    1065455.9150 2836273.68   166%  4419  145s
H  236   200                    1065828.5613 2836110.47   166%  2605  145s
H  251   307                    1066199.6786 2836110.47   166%  2468  150s
H  365   399                    1072961.3873 2836110.47   164%  1848  152s
H  371   399                    1085598.5776 2836110.47   161%  1822  152s
H  438   399                    1102058.0958 2836110.47   157%  1584  152s
H  461   486                    1104653.4407 2836110.47   157%  1521  155s
H  559   547                    1105844.0974 2836110.47   156%  1310  156s
H  560   547                    1111748.3025 2836110.47   155%  1309  156s
H  563   547                    1112116.1982 2836110.47   155%  1303  156s
H  564   547                    1117697.3561 2836110.47   154%  1301  156s
H  593   547                    1122194.6381 2836110.47   153%  1249  156s
   620   624 2722747.31   24 2946 1122194.64 2836110.47   153%  1210  160s
H  706   668                    1122559.7862 2836110.47   153%  1113  163s
H  707   668                    1124197.9428 2836110.47   152%  1112  163s
H  709   668                    1125754.1216 2836110.47   152%  1109  163s
H  712   668                    1126425.3489 2836110.47   152%  1106  163s
H  730   668                    1130608.0109 2836110.47   151%  1088  163s
H  743   668                    1131932.3603 2836110.47   151%  1079  163s
H  757   748                    1134053.7899 2836110.47   150%  1062  165s
H  843   785                    1134418.9381 2836110.47   150%   985  166s
H  844   785                    1134885.7660 2836110.47   150%   984  166s
H  846   785                    1138711.3733 2836110.47   149%   982  166s
H  851   785                    1143860.6365 2836110.47   148%   978  166s
H  991   917                    1147851.0549 2836110.47   147%   873  169s
H  993   917                    1159325.7498 2836110.47   145%   871  169s
  1034  1014 2654702.08   35 2903 1159325.75 2836110.47   145%   848  172s
H 1139  1041                    1163694.2784 2836110.47   144%   793  174s
H 1155  1041                    1164109.5307 2836110.47   144%   785  174s
H 1166  1041                    1164681.6440 2836110.47   144%   780  174s
H 1169  1041                    1165706.3458 2836110.47   143%   778  174s
  1172  1153 2648302.39   38 2906 1165706.35 2836110.47   143%   777  176s
  1421  1372 2617379.88   48 2823 1165706.35 2836110.47   143%   677  182s
  1688  1620 2603907.19   56 2848 1165706.35 2836110.47   143%   608  186s
  2106  2010 2585127.62   66 2842 1165706.35 2836110.47   143%   532  192s
H 2252  2063                    1178119.3405 2836110.47   141%   512  194s
H 2290  2063                    1187983.9822 2836110.47   139%   508  194s
H 2303  2063                    1194265.8309 2836110.47   137%   505  194s
  2313  2189 2570317.77   71 2851 1194265.83 2836110.47   137%   504  197s
  2629  2517 2551369.72   79 2826 1194265.83 2836110.47   137%   473  201s
  3032  2882 2526897.96   92 2800 1194265.83 2836110.47   137%   433  206s
H 3247  2882                    1194707.8089 2836110.47   137%   416  217s
H 3247  2882                    1197138.0394 2836110.47   137%   416  219s
H 3247  2882                    1199198.0062 2836110.47   137%   416  222s
H 3247  2882                    1199978.1460 2836110.47   136%   416  227s
H 3247  2882                    1200431.4473 2836110.47   136%   416  228s
H 3247  2882                    1201137.5987 2836110.47   136%   416  233s
H 3247  2882                    1204898.8246 2836110.47   135%   416  235s
H 3247  2882                    1205779.6694 2836110.47   135%   416  239s
H 3247  2882                    1206401.7411 2836110.47   135%   416  240s
  3248  2883 2407803.95  116 2857 1206401.74 2836110.47   135%   416  276s
  3250  2884 2592375.50   14 3723 1206401.74 2836110.47   135%   416  293s

Cutting planes:
  Learned: 442
  Gomory: 28
  Cover: 247
  Implied bound: 210
  Projected implied bound: 31
  Clique: 199
  MIR: 200
  StrongCG: 9
  Flow cover: 363
  GUB cover: 14
  RLT: 490
  Relax-and-lift: 86
  BQP: 173
  PSD: 7

Explored 3250 nodes (1551678 simplex iterations) in 180.09 seconds (192.96 work units)
Thread count was 32 (of 32 available processors)

Solution count 10: 1.2064e+06 1.20578e+06 1.2049e+06 ... 1.19427e+06

Time limit reached
Best objective 1.206401741142e+06, best bound 2.655489564893e+06, gap 120.1165%
Set parameter TimeLimit to value 300
Gurobi Optimizer version 12.0.3 build v12.0.3rc0 (linux64)

CPU model: Intel(R) Xeon(R) Gold 6130 CPU @ 2.10GHz, instruction set [SSE2|AVX|AVX2|AVX512]
Thread count: 32 physical cores, 32 logical processors, using up to 32 threads

Non-default parameters:
TimeLimit  300
SoftMemLimit  120

Academic license 2736771 - for non-commercial use only - registered to er___@sabanciuniv.edu
Optimize a model with 32811 rows, 18706 columns and 3715730 nonzeros
Model fingerprint: 0x618c6813
Variable types: 8460 continuous, 10246 integer (10246 binary)
Coefficient statistics:
  Matrix range     [1e+00, 2e+05]
  Objective range  [9e+01, 5e+04]
  Bounds range     [1e+00, 1e+00]
  RHS range        [1e+00, 2e+05]
Presolved: 30125 rows, 18909 columns, 1294527 nonzeros

Continuing optimization...

  3251  2888 2649509.75   15 3320 1206401.74 2649509.75   120%   436  310s
  3253  2891 2366780.89   16 3308 1206401.74 2630180.85   118%   440  315s
  3257  2898 2366780.89   17 3307 1206401.74 2366780.89  96.2%   449  323s
  3265  2909 2190577.61   18 3181 1206401.74 2355996.65  95.3%   453  327s
  3281  2934 2188859.35   19 3169 1206401.74 2188859.35  81.4%   493  337s
  3311  2956 2157050.00   20 3167 1206401.74 2179671.55  80.7%   504  344s
  3343  3052 2145946.61   21 3117 1206401.74 2165005.13  79.5%   540  352s
  3451  3090 2139091.07   23 3108 1206401.74 2165005.13  79.5%   551  363s
  3526  3125 2136059.90   24 3104 1206401.74 2165005.13  79.5%   550  367s
  3622  3168 2135233.60   25 3081 1206401.74 2165005.13  79.5%   546  370s
  3776  3259 2130738.51   27 3052 1206401.74 2165005.13  79.5%   539  377s
  3851  3301 2124648.90   28 3085 1206401.74 2165005.13  79.5%   539  380s
  3970  3368 2100072.30   30 3046 1206401.74 2165005.13  79.5%   535  387s
  4030  3407 2097854.41   31 3046 1206401.74 2165005.13  79.5%   533  390s
  4151  3479 2088306.15   33 3025 1206401.74 2165005.13  79.5%   531  400s
  4210  3508 2073197.11   33 2966 1206401.74 2160087.56  79.1%   532  406s
  4261  3540 2085972.80   34 3029 1206401.74 2160087.56  79.1%   544  410s
  4383  3625 2079885.09   37 3025 1206401.74 2160087.56  79.1%   547  427s
  4438  3682 2077867.18   38 3038 1206401.74 2160087.56  79.1%   545  431s
  4611  3810 2038794.55   40 2990 1206401.74 2160087.56  79.1%   536  438s
  4708  3862 2056203.11   41 2977 1206401.74 2160087.56  79.1%   533  443s
  4795  3931 2039857.39   42 2951 1206401.74 2160087.56  79.1%   531  447s
  4897  3974 2037034.79   44 2954 1206401.74 2160087.56  79.1%   529  452s
  4978  4059 2021983.61   45 2916 1206401.74 2160087.56  79.1%   528  456s
  5094  4148 2045281.55   47 2939 1206401.74 2160087.56  79.1%   526  461s
  5227  4207 2046132.80   49 2952 1206401.74 2160087.56  79.1%   520  465s
  5336  4305 2043888.86   50 2904 1206401.74 2160087.56  79.1%   516  470s
  5481  4359 2042002.32   53 2880 1206401.74 2160087.56  79.1%   510  475s
  5589  4484 2017146.75   54 2855 1206401.74 2160087.56  79.1%   508  480s
  5754  4515 2035073.01   57 2929 1206401.74 2160087.56  79.1%   502  492s
  5843  4609 2027634.75   58 2928 1206401.74 2160087.56  79.1%   500  498s
  5981  4736 2022702.62   60 2929 1206401.74 2160087.56  79.1%   497  504s
  6164  4857 2009963.69   63 2896 1206401.74 2160087.56  79.1%   490  509s
  6375  4930 2006367.16   66 2877 1206401.74 2160087.56  79.1%   482  516s
  6545  5079 1984122.61   70 2848 1206401.74 2160087.56  79.1%   477  523s
  6792  5199 infeasible   74      1206401.74 2160087.56  79.1%   471  529s
  7049  5279 1963110.31   79 2802 1206401.74 2160087.56  79.1%   464  538s
  7246  5305 1967476.78   82 2801 1206401.74 2160087.56  79.1%   460  555s
  7354  5530 1965907.56   84 2791 1206401.74 2160087.56  79.1%   462  562s
  7669  5591 1934702.72   88 2723 1206401.74 2160087.56  79.1%   453  569s
  7901  5857 1939936.65   91 2749 1206401.74 2160087.56  79.1%   445  577s
  8332  6048 1924513.16   99 2732 1206401.74 2160087.56  79.1%   431  585s
  8701  6554 1910934.36  106 2712 1206401.74 2160087.56  79.1%   420  592s
  9407  6653 1881828.71  120 2670 1206401.74 2160087.56  79.1%   408  600s

Cutting planes:
  Learned: 507
  Gomory: 58
  Cover: 763
  Implied bound: 492
  Projected implied bound: 62
  Clique: 238
  MIR: 296
  StrongCG: 9
  Flow cover: 849
  GUB cover: 156
  RLT: 577
  Relax-and-lift: 140
  BQP: 192
  PSD: 7

Explored 9783 nodes (4107836 simplex iterations) in 300.08 seconds (291.10 work units)
Thread count was 32 (of 32 available processors)

Solution count 10: 1.2064e+06 1.20578e+06 1.2049e+06 ... 1.19427e+06

Time limit reached
Best objective 1.206401741142e+06, best bound 2.160087563455e+06, gap 79.0521%
Set parameter TimeLimit to value 300
Gurobi Optimizer version 12.0.3 build v12.0.3rc0 (linux64)

CPU model: Intel(R) Xeon(R) Gold 6130 CPU @ 2.10GHz, instruction set [SSE2|AVX|AVX2|AVX512]
Thread count: 32 physical cores, 32 logical processors, using up to 32 threads

Non-default parameters:
TimeLimit  300
SoftMemLimit  120

Academic license 2736771 - for non-commercial use only - registered to er___@sabanciuniv.edu
Optimize a model with 32811 rows, 18706 columns and 3715730 nonzeros
Model fingerprint: 0x618c6813
Variable types: 8460 continuous, 10246 integer (10246 binary)
Coefficient statistics:
  Matrix range     [1e+00, 2e+05]
  Objective range  [9e+01, 5e+04]
  Bounds range     [1e+00, 1e+00]
  RHS range        [1e+00, 2e+05]
Presolved: 30125 rows, 18909 columns, 1294527 nonzeros

Continuing optimization...

  9783  7157 1860774.14  125 2625 1206401.74 2160087.56  79.1%   405  612s
 10537  7319 1858858.55  137 2634 1206401.74 2160087.56  79.1%   409  616s
 11038  7679 1855977.85  142 2583 1206401.74 2160087.56  79.1%   404  621s
 11632  7623 1852587.65  146 2573 1206401.74 2160087.56  79.1%   394  625s
 11799  7743 1845394.73  151 2528 1206401.74 2160087.56  79.1%   394  631s
 12666  8847 1807171.46  171 2413 1206401.74 2155298.36  78.7%   383  639s
 13251  9386 1794504.89  182 2447 1206401.74 2155298.36  78.7%   376  642s
 13833  9556 1779975.89  188 2368 1206401.74 2155298.36  78.7%   369  646s
 14039  9781 1775968.34  193 2328 1206401.74 2155298.36  78.7%   369  652s
 14296 10381 1765886.90  196 2315 1206401.74 2148965.14  78.1%   367  656s
 14975 10967 1751737.39  206 2287 1206401.74 2148965.14  78.1%   361  660s
 15666 11723 1726371.69  218 2278 1206401.74 2148965.14  78.1%   355  665s
 16557 12243 1715010.33  228 2269 1206401.74 2145350.18  77.8%   345  672s
 17308 12388 2077724.86   21 3057 1206401.74 2145350.18  77.8%   340  678s
 17503 12527 2062113.44   28 3054 1206401.74 2145350.18  77.8%   343  683s
 17745 12805 2052776.10   35 2987 1206401.74 2145350.18  77.8%   344  688s
 18075 13677 2049170.70   39 2957 1206401.74 2145350.18  77.8%   342  693s
 19023 14365 2028755.02   49 2898 1206401.74 2145350.18  77.8%   335  699s
 19761 15272 1972426.18   74 2857 1206401.74 2145350.18  77.8%   332  703s
 20849 15331 1941096.84   93 2817 1206401.74 2145350.18  77.8%   324  737s
 20929 15518 1945844.43   93 2779 1206401.74 2145350.18  77.8%   324  744s
 21223 15779 1931263.28  101 2802 1206401.74 2145350.18  77.8%   326  751s
 21641 16686 1912538.80  112 2781 1206401.74 2145350.18  77.8%   326  757s
 22732 17583 1879177.83  137 2672 1206401.74 2145350.18  77.8%   321  764s
 23839 18388 1876876.08  138 2695 1206401.74 2145350.18  77.8%   316  770s
 24869 19556 1844162.69  149 2651 1206401.74 2145350.18  77.8%   314  776s
 26397 19841 1832802.51  162 2602 1206401.74 2145350.18  77.8%   305  783s
 26758 20242 1788809.33  175 2596 1206401.74 2145350.18  77.8%   306  791s
 27234 21562 1787229.98  181 2564 1206401.74 2145350.18  77.8%   306  799s
 28775 22789 1764740.61  190 2564 1206401.74 2145350.18  77.8%   299  806s
 30225 25802 1751342.52  203 2557 1206401.74 2145350.18  77.8%   294  824s
 34020 25916 1677999.24  267 2334 1206401.74 2145350.18  77.8%   280  832s
 34249 26176 1672827.88  267 2330 1206401.74 2143671.78  77.7%   283  838s
 34576 26621 1663164.54  279 2279 1206401.74 2143671.78  77.7%   285  844s
 35104 28115 1651743.32  295 2245 1206401.74 2143671.78  77.7%   284  853s
 36973 29586 1624165.27  320 2103 1206401.74 2143671.78  77.7%   278  863s
 38776 30734 1606279.60  348 2031 1206401.74 2143671.78  77.7%   273  872s
 40258 31902 1596634.15  380 2127 1206401.74 2143671.78  77.7%   270  880s
 41542 33294 1555143.31  419 1943 1206401.74 2143671.78  77.7%   269  889s
 43036 33433 1525724.05  471 1754 1206401.74 2143671.78  77.7%   267  899s
 43267 33457 infeasible  469      1206401.74 2143671.78  77.7%   268  900s

Cutting planes:
  Learned: 513
  Gomory: 58
  Cover: 989
  Implied bound: 552
  Projected implied bound: 71
  Clique: 241
  MIR: 351
  StrongCG: 9
  Flow cover: 946
  GUB cover: 167
  Inf proof: 24
  Zero half: 2
  RLT: 608
  Relax-and-lift: 145
  BQP: 193
  PSD: 7

Explored 43295 nodes (11739691 simplex iterations) in 300.25 seconds (287.93 work units)
Thread count was 32 (of 32 available processors)

Solution count 10: 1.2064e+06 1.20578e+06 1.2049e+06 ... 1.19427e+06

Time limit reached
Best objective 1.206401741142e+06, best bound 2.143671778390e+06, gap 77.6914%
Set parameter TimeLimit to value 900
Gurobi Optimizer version 12.0.3 build v12.0.3rc0 (linux64)

CPU model: Intel(R) Xeon(R) Gold 6130 CPU @ 2.10GHz, instruction set [SSE2|AVX|AVX2|AVX512]
Thread count: 32 physical cores, 32 logical processors, using up to 32 threads

Non-default parameters:
TimeLimit  900
SoftMemLimit  120


> Task :runMipSolver FAILED
2 actionable tasks: 1 executed, 1 up-to-date

Command 1 FAILED (Duration: 916.35s)

[2/33] Starting command 2...
Executing: ./gradlew runMipSolver -PinstancePath="instances/density=HIGH_nInventory=10_nHours=3_seed=4.json" -PoutputPath="November2/continuous" -PmodelType="Continuous" -PcheckPointTimes="30,60,120,300,600,900,1800,3600,7200" -PlogPath="November2/continuous/density=HIGH_nInventory=10_nHours=3_seed=4.json/mip.log"
Command failed with return code: 1
Error: 
FAILURE: Build failed with an exception.

* What went wrong:
Execution failed for task ':runMipSolver'.
> Process 'command '/cta/users/erhun.kundakcioglu/jdk-21.0.3+9/bin/java'' finished with non-zero exit value 1

* Try:
> Run with --stacktrace option to get the stack trace.
> Run with --info or --debug option to get more log output.
> Run with --scan to get full insights.
> Get more help at https://help.gradle.org.

BUİLD FAILED in 4s

> Task :compileJava UP-TO-DATE
> Task :processResources NO-SOURCE
> Task :classes UP-TO-DATE

> Task :runMipSolver
Running MIP Solver with arguments: --instancePath=instances/density=HIGH_nInventory=10_nHours=3_seed=4.json --outputPath=November2/continuous --modelType=Continuous --checkPointTimes=30,60,120,300,600,900,1800,3600,7200 --logPath=November2/continuous/density=HIGH_nInventory=10_nHours=3_seed=4.json/mip.log
Loading problem instance...
Set parameter WLSAccessID
Set parameter WLSSecret
Set parameter LicenseID to value 2736771

> Task :runMipSolver FAILED
2 actionable tasks: 1 executed, 1 up-to-date

Command 2 FAILED (Duration: 4.82s)

[3/33] Starting command 3...
Executing: ./gradlew runMipSolver -PinstancePath="instances/density=LOW_nInventory=15_nHours=4_seed=2.json" -PoutputPath="November2/continuous" -PmodelType="Continuous" -PcheckPointTimes="30,60,120,300,600,900,1800,3600,7200" -PlogPath="November2/continuous/density=LOW_nInventory=15_nHours=4_seed=2.json/mip.log"
Command failed with return code: 1
Error: 
FAILURE: Build failed with an exception.

* What went wrong:
Execution failed for task ':runMipSolver'.
> Process 'command '/cta/users/erhun.kundakcioglu/jdk-21.0.3+9/bin/java'' finished with non-zero exit value 1

* Try:
> Run with --stacktrace option to get the stack trace.
> Run with --info or --debug option to get more log output.
> Run with --scan to get full insights.
> Get more help at https://help.gradle.org.

BUİLD FAILED in 4s

> Task :compileJava UP-TO-DATE
> Task :processResources NO-SOURCE
> Task :classes UP-TO-DATE

> Task :runMipSolver
Running MIP Solver with arguments: --instancePath=instances/density=LOW_nInventory=15_nHours=4_seed=2.json --outputPath=November2/continuous --modelType=Continuous --checkPointTimes=30,60,120,300,600,900,1800,3600,7200 --logPath=November2/continuous/density=LOW_nInventory=15_nHours=4_seed=2.json/mip.log
Loading problem instance...
Set parameter WLSAccessID
Set parameter WLSSecret
Set parameter LicenseID to value 2736771

> Task :runMipSolver FAILED
2 actionable tasks: 1 executed, 1 up-to-date

Command 3 FAILED (Duration: 4.90s)

[4/33] Starting command 4...
Executing: ./gradlew runMipSolver -PinstancePath="instances/density=HIGH_nInventory=20_nHours=5_seed=7.json" -PoutputPath="November2/continuous" -PmodelType="Continuous" -PcheckPointTimes="30,60,120,300,600,900,1800,3600,7200" -PlogPath="November2/continuous/density=HIGH_nInventory=20_nHours=5_seed=7.json/mip.log"
Command failed with return code: 1
Error: 
FAILURE: Build failed with an exception.

* What went wrong:
Execution failed for task ':runMipSolver'.
> Process 'command '/cta/users/erhun.kundakcioglu/jdk-21.0.3+9/bin/java'' finished with non-zero exit value 1

* Try:
> Run with --stacktrace option to get the stack trace.
> Run with --info or --debug option to get more log output.
> Run with --scan to get full insights.
> Get more help at https://help.gradle.org.

BUİLD FAILED in 4s

> Task :compileJava UP-TO-DATE
> Task :processResources NO-SOURCE
> Task :classes UP-TO-DATE

> Task :runMipSolver
Running MIP Solver with arguments: --instancePath=instances/density=HIGH_nInventory=20_nHours=5_seed=7.json --outputPath=November2/continuous --modelType=Continuous --checkPointTimes=30,60,120,300,600,900,1800,3600,7200 --logPath=November2/continuous/density=HIGH_nInventory=20_nHours=5_seed=7.json/mip.log
Loading problem instance...
Set parameter WLSAccessID
Set parameter WLSSecret
Set parameter LicenseID to value 2736771

> Task :runMipSolver FAILED
2 actionable tasks: 1 executed, 1 up-to-date

Command 4 FAILED (Duration: 4.66s)

[5/33] Starting command 5...
Executing: ./gradlew runMipSolver -PinstancePath="instances/density=LOW_nInventory=20_nHours=5_seed=2.json" -PoutputPath="November2/continuous" -PmodelType="Continuous" -PcheckPointTimes="30,60,120,300,600,900,1800,3600,7200" -PlogPath="November2/continuous/density=LOW_nInventory=20_nHours=5_seed=2.json/mip.log"
Command failed with return code: 1
Error: 
FAILURE: Build failed with an exception.

* What went wrong:
Execution failed for task ':runMipSolver'.
> Process 'command '/cta/users/erhun.kundakcioglu/jdk-21.0.3+9/bin/java'' finished with non-zero exit value 1

* Try:
> Run with --stacktrace option to get the stack trace.
> Run with --info or --debug option to get more log output.
> Run with --scan to get full insights.
> Get more help at https://help.gradle.org.

BUİLD FAILED in 4s

> Task :compileJava UP-TO-DATE
> Task :processResources NO-SOURCE
> Task :classes UP-TO-DATE

> Task :runMipSolver
Running MIP Solver with arguments: --instancePath=instances/density=LOW_nInventory=20_nHours=5_seed=2.json --outputPath=November2/continuous --modelType=Continuous --checkPointTimes=30,60,120,300,600,900,1800,3600,7200 --logPath=November2/continuous/density=LOW_nInventory=20_nHours=5_seed=2.json/mip.log
Loading problem instance...
Set parameter WLSAccessID
Set parameter WLSSecret
Set parameter LicenseID to value 2736771

> Task :runMipSolver FAILED
2 actionable tasks: 1 executed, 1 up-to-date

Command 5 FAILED (Duration: 5.21s)

[6/33] Starting command 6...
Executing: ./gradlew runMipSolver -PinstancePath="instances/density=HIGH_nInventory=15_nHours=4_seed=7.json" -PoutputPath="November2/continuous" -PmodelType="Continuous" -PcheckPointTimes="30,60,120,300,600,900,1800,3600,7200" -PlogPath="November2/continuous/density=HIGH_nInventory=15_nHours=4_seed=7.json/mip.log"
Command failed with return code: 1
Error: 
FAILURE: Build failed with an exception.

* What went wrong:
Execution failed for task ':runMipSolver'.
> Process 'command '/cta/users/erhun.kundakcioglu/jdk-21.0.3+9/bin/java'' finished with non-zero exit value 1

* Try:
> Run with --stacktrace option to get the stack trace.
> Run with --info or --debug option to get more log output.
> Run with --scan to get full insights.
> Get more help at https://help.gradle.org.

BUİLD FAILED in 4s

> Task :compileJava UP-TO-DATE
> Task :processResources NO-SOURCE
> Task :classes UP-TO-DATE

> Task :runMipSolver
Running MIP Solver with arguments: --instancePath=instances/density=HIGH_nInventory=15_nHours=4_seed=7.json --outputPath=November2/continuous --modelType=Continuous --checkPointTimes=30,60,120,300,600,900,1800,3600,7200 --logPath=November2/continuous/density=HIGH_nInventory=15_nHours=4_seed=7.json/mip.log
Loading problem instance...
Set parameter WLSAccessID
Set parameter WLSSecret
Set parameter LicenseID to value 2736771

> Task :runMipSolver FAILED
2 actionable tasks: 1 executed, 1 up-to-date

Command 6 FAILED (Duration: 4.90s)

[7/33] Starting command 7...
Executing: ./gradlew runMipSolver -PinstancePath="instances/density=LOW_nInventory=10_nHours=3_seed=1.json" -PoutputPath="November2/continuous" -PmodelType="Continuous" -PcheckPointTimes="30,60,120,300,600,900,1800,3600,7200" -PlogPath="November2/continuous/density=LOW_nInventory=10_nHours=3_seed=1.json/mip.log"
Command failed with return code: 1
Error: 
FAILURE: Build failed with an exception.

* What went wrong:
Execution failed for task ':runMipSolver'.
> Process 'command '/cta/users/erhun.kundakcioglu/jdk-21.0.3+9/bin/java'' finished with non-zero exit value 1

* Try:
> Run with --stacktrace option to get the stack trace.
> Run with --info or --debug option to get more log output.
> Run with --scan to get full insights.
> Get more help at https://help.gradle.org.

BUİLD FAILED in 4s

> Task :compileJava UP-TO-DATE
> Task :processResources NO-SOURCE
> Task :classes UP-TO-DATE

> Task :runMipSolver
Running MIP Solver with arguments: --instancePath=instances/density=LOW_nInventory=10_nHours=3_seed=1.json --outputPath=November2/continuous --modelType=Continuous --checkPointTimes=30,60,120,300,600,900,1800,3600,7200 --logPath=November2/continuous/density=LOW_nInventory=10_nHours=3_seed=1.json/mip.log
Loading problem instance...
Set parameter WLSAccessID
Set parameter WLSSecret
Set parameter LicenseID to value 2736771

> Task :runMipSolver FAILED
2 actionable tasks: 1 executed, 1 up-to-date

Command 7 FAILED (Duration: 4.73s)

[8/33] Starting command 8...
Executing: ./gradlew runMipSolver -PinstancePath="instances/density=HIGH_nInventory=15_nHours=4_seed=6.json" -PoutputPath="November2/continuous" -PmodelType="Continuous" -PcheckPointTimes="30,60,120,300,600,900,1800,3600,7200" -PlogPath="November2/continuous/density=HIGH_nInventory=15_nHours=4_seed=6.json/mip.log"
Command failed with return code: 1
Error: 
FAILURE: Build failed with an exception.

* What went wrong:
Execution failed for task ':runMipSolver'.
> Process 'command '/cta/users/erhun.kundakcioglu/jdk-21.0.3+9/bin/java'' finished with non-zero exit value 1

* Try:
> Run with --stacktrace option to get the stack trace.
> Run with --info or --debug option to get more log output.
> Run with --scan to get full insights.
> Get more help at https://help.gradle.org.

BUİLD FAILED in 4s

> Task :compileJava UP-TO-DATE
> Task :processResources NO-SOURCE
> Task :classes UP-TO-DATE

> Task :runMipSolver
Running MIP Solver with arguments: --instancePath=instances/density=HIGH_nInventory=15_nHours=4_seed=6.json --outputPath=November2/continuous --modelType=Continuous --checkPointTimes=30,60,120,300,600,900,1800,3600,7200 --logPath=November2/continuous/density=HIGH_nInventory=15_nHours=4_seed=6.json/mip.log
Loading problem instance...
Set parameter WLSAccessID
Set parameter WLSSecret
Set parameter LicenseID to value 2736771

> Task :runMipSolver FAILED
2 actionable tasks: 1 executed, 1 up-to-date

Command 8 FAILED (Duration: 5.11s)

[9/33] Starting command 9...
Executing: ./gradlew runMipSolver -PinstancePath="instances/density=LOW_nInventory=20_nHours=5_seed=3.json" -PoutputPath="November2/continuous" -PmodelType="Continuous" -PcheckPointTimes="30,60,120,300,600,900,1800,3600,7200" -PlogPath="November2/continuous/density=LOW_nInventory=20_nHours=5_seed=3.json/mip.log"
Command failed with return code: 1
Error: 
FAILURE: Build failed with an exception.

* What went wrong:
Execution failed for task ':runMipSolver'.
> Process 'command '/cta/users/erhun.kundakcioglu/jdk-21.0.3+9/bin/java'' finished with non-zero exit value 1

* Try:
> Run with --stacktrace option to get the stack trace.
> Run with --info or --debug option to get more log output.
> Run with --scan to get full insights.
> Get more help at https://help.gradle.org.

BUİLD FAILED in 4s

> Task :compileJava UP-TO-DATE
> Task :processResources NO-SOURCE
> Task :classes UP-TO-DATE

> Task :runMipSolver
Running MIP Solver with arguments: --instancePath=instances/density=LOW_nInventory=20_nHours=5_seed=3.json --outputPath=November2/continuous --modelType=Continuous --checkPointTimes=30,60,120,300,600,900,1800,3600,7200 --logPath=November2/continuous/density=LOW_nInventory=20_nHours=5_seed=3.json/mip.log
Loading problem instance...
Set parameter WLSAccessID
Set parameter WLSSecret
Set parameter LicenseID to value 2736771

> Task :runMipSolver FAILED
2 actionable tasks: 1 executed, 1 up-to-date

Command 9 FAILED (Duration: 5.03s)

[10/33] Starting command 10...
Executing: ./gradlew runMipSolver -PinstancePath="instances/density=HIGH_nInventory=20_nHours=5_seed=6.json" -PoutputPath="November2/continuous" -PmodelType="Continuous" -PcheckPointTimes="30,60,120,300,600,900,1800,3600,7200" -PlogPath="November2/continuous/density=HIGH_nInventory=20_nHours=5_seed=6.json/mip.log"
Command failed with return code: 1
Error: 
FAILURE: Build failed with an exception.

* What went wrong:
Execution failed for task ':runMipSolver'.
> Process 'command '/cta/users/erhun.kundakcioglu/jdk-21.0.3+9/bin/java'' finished with non-zero exit value 1

* Try:
> Run with --stacktrace option to get the stack trace.
> Run with --info or --debug option to get more log output.
> Run with --scan to get full insights.
> Get more help at https://help.gradle.org.

BUİLD FAILED in 4s

> Task :compileJava UP-TO-DATE
> Task :processResources NO-SOURCE
> Task :classes UP-TO-DATE

> Task :runMipSolver
Running MIP Solver with arguments: --instancePath=instances/density=HIGH_nInventory=20_nHours=5_seed=6.json --outputPath=November2/continuous --modelType=Continuous --checkPointTimes=30,60,120,300,600,900,1800,3600,7200 --logPath=November2/continuous/density=HIGH_nInventory=20_nHours=5_seed=6.json/mip.log
Loading problem instance...
Set parameter WLSAccessID
Set parameter WLSSecret
Set parameter LicenseID to value 2736771

> Task :runMipSolver FAILED
2 actionable tasks: 1 executed, 1 up-to-date

Command 10 FAILED (Duration: 4.72s)

[11/33] Starting command 11...
Executing: ./gradlew runMipSolver -PinstancePath="instances/density=LOW_nInventory=15_nHours=4_seed=3.json" -PoutputPath="November2/continuous" -PmodelType="Continuous" -PcheckPointTimes="30,60,120,300,600,900,1800,3600,7200" -PlogPath="November2/continuous/density=LOW_nInventory=15_nHours=4_seed=3.json/mip.log"
Command failed with return code: 1
Error: 
FAILURE: Build failed with an exception.

* What went wrong:
Execution failed for task ':runMipSolver'.
> Process 'command '/cta/users/erhun.kundakcioglu/jdk-21.0.3+9/bin/java'' finished with non-zero exit value 1

* Try:
> Run with --stacktrace option to get the stack trace.
> Run with --info or --debug option to get more log output.
> Run with --scan to get full insights.
> Get more help at https://help.gradle.org.

BUİLD FAILED in 4s

> Task :compileJava UP-TO-DATE
> Task :processResources NO-SOURCE
> Task :classes UP-TO-DATE

> Task :runMipSolver
Running MIP Solver with arguments: --instancePath=instances/density=LOW_nInventory=15_nHours=4_seed=3.json --outputPath=November2/continuous --modelType=Continuous --checkPointTimes=30,60,120,300,600,900,1800,3600,7200 --logPath=November2/continuous/density=LOW_nInventory=15_nHours=4_seed=3.json/mip.log
Loading problem instance...
Set parameter WLSAccessID
Set parameter WLSSecret
Set parameter LicenseID to value 2736771

> Task :runMipSolver FAILED
2 actionable tasks: 1 executed, 1 up-to-date

Command 11 FAILED (Duration: 5.03s)

[12/33] Starting command 12...
Executing: ./gradlew runMipSolver -PinstancePath="instances/density=HIGH_nInventory=10_nHours=3_seed=5.json" -PoutputPath="November2/continuous" -PmodelType="Continuous" -PcheckPointTimes="30,60,120,300,600,900,1800,3600,7200" -PlogPath="November2/continuous/density=HIGH_nInventory=10_nHours=3_seed=5.json/mip.log"
Command failed with return code: 1
Error: 
FAILURE: Build failed with an exception.

* What went wrong:
Execution failed for task ':runMipSolver'.
> Process 'command '/cta/users/erhun.kundakcioglu/jdk-21.0.3+9/bin/java'' finished with non-zero exit value 1

* Try:
> Run with --stacktrace option to get the stack trace.
> Run with --info or --debug option to get more log output.
> Run with --scan to get full insights.
> Get more help at https://help.gradle.org.

BUİLD FAILED in 4s

> Task :compileJava UP-TO-DATE
> Task :processResources NO-SOURCE
> Task :classes UP-TO-DATE

> Task :runMipSolver
Running MIP Solver with arguments: --instancePath=instances/density=HIGH_nInventory=10_nHours=3_seed=5.json --outputPath=November2/continuous --modelType=Continuous --checkPointTimes=30,60,120,300,600,900,1800,3600,7200 --logPath=November2/continuous/density=HIGH_nInventory=10_nHours=3_seed=5.json/mip.log
Loading problem instance...
Set parameter WLSAccessID
Set parameter WLSSecret
Set parameter LicenseID to value 2736771

> Task :runMipSolver FAILED
2 actionable tasks: 1 executed, 1 up-to-date

Command 12 FAILED (Duration: 4.82s)

[13/33] Starting command 13...
Executing: ./gradlew runMipSolver -PinstancePath="instances/density=HIGH_nInventory=10_nHours=3_seed=10.json" -PoutputPath="November2/continuous" -PmodelType="Continuous" -PcheckPointTimes="30,60,120,300,600,900,1800,3600,7200" -PlogPath="November2/continuous/density=HIGH_nInventory=10_nHours=3_seed=10.json/mip.log"
Command failed with return code: 1
Error: 
FAILURE: Build failed with an exception.

* What went wrong:
Execution failed for task ':runMipSolver'.
> Process 'command '/cta/users/erhun.kundakcioglu/jdk-21.0.3+9/bin/java'' finished with non-zero exit value 1

* Try:
> Run with --stacktrace option to get the stack trace.
> Run with --info or --debug option to get more log output.
> Run with --scan to get full insights.
> Get more help at https://help.gradle.org.

BUİLD FAILED in 4s

> Task :compileJava UP-TO-DATE
> Task :processResources NO-SOURCE
> Task :classes UP-TO-DATE

> Task :runMipSolver
Running MIP Solver with arguments: --instancePath=instances/density=HIGH_nInventory=10_nHours=3_seed=10.json --outputPath=November2/continuous --modelType=Continuous --checkPointTimes=30,60,120,300,600,900,1800,3600,7200 --logPath=November2/continuous/density=HIGH_nInventory=10_nHours=3_seed=10.json/mip.log
Loading problem instance...
Set parameter WLSAccessID
Set parameter WLSSecret
Set parameter LicenseID to value 2736771

> Task :runMipSolver FAILED
2 actionable tasks: 1 executed, 1 up-to-date

Command 13 FAILED (Duration: 4.96s)

[14/33] Starting command 14...
Executing: ./gradlew runMipSolver -PinstancePath="instances/density=MEDIUM_nInventory=10_nHours=3_seed=1.json" -PoutputPath="November2/continuous" -PmodelType="Continuous" -PcheckPointTimes="30,60,120,300,600,900,1800,3600,7200" -PlogPath="November2/continuous/density=MEDIUM_nInventory=10_nHours=3_seed=1.json/mip.log"
Command failed with return code: 1
Error: 
FAILURE: Build failed with an exception.

* What went wrong:
Execution failed for task ':runMipSolver'.
> Process 'command '/cta/users/erhun.kundakcioglu/jdk-21.0.3+9/bin/java'' finished with non-zero exit value 1

* Try:
> Run with --stacktrace option to get the stack trace.
> Run with --info or --debug option to get more log output.
> Run with --scan to get full insights.
> Get more help at https://help.gradle.org.

BUİLD FAILED in 4s

> Task :compileJava UP-TO-DATE
> Task :processResources NO-SOURCE
> Task :classes UP-TO-DATE

> Task :runMipSolver
Running MIP Solver with arguments: --instancePath=instances/density=MEDIUM_nInventory=10_nHours=3_seed=1.json --outputPath=November2/continuous --modelType=Continuous --checkPointTimes=30,60,120,300,600,900,1800,3600,7200 --logPath=November2/continuous/density=MEDIUM_nInventory=10_nHours=3_seed=1.json/mip.log
Loading problem instance...
Set parameter WLSAccessID
Set parameter WLSSecret
Set parameter LicenseID to value 2736771

> Task :runMipSolver FAILED
2 actionable tasks: 1 executed, 1 up-to-date

Command 14 FAILED (Duration: 5.04s)

[15/33] Starting command 15...
Executing: ./gradlew runMipSolver -PinstancePath="instances/density=HIGH_nInventory=20_nHours=5_seed=10.json" -PoutputPath="November2/continuous" -PmodelType="Continuous" -PcheckPointTimes="30,60,120,300,600,900,1800,3600,7200" -PlogPath="November2/continuous/density=HIGH_nInventory=20_nHours=5_seed=10.json/mip.log"
Command failed with return code: 1
Error: 
FAILURE: Build failed with an exception.

* What went wrong:
Execution failed for task ':runMipSolver'.
> Process 'command '/cta/users/erhun.kundakcioglu/jdk-21.0.3+9/bin/java'' finished with non-zero exit value 1

* Try:
> Run with --stacktrace option to get the stack trace.
> Run with --info or --debug option to get more log output.
> Run with --scan to get full insights.
> Get more help at https://help.gradle.org.

BUİLD FAILED in 4s

> Task :compileJava UP-TO-DATE
> Task :processResources NO-SOURCE
> Task :classes UP-TO-DATE

> Task :runMipSolver
Running MIP Solver with arguments: --instancePath=instances/density=HIGH_nInventory=20_nHours=5_seed=10.json --outputPath=November2/continuous --modelType=Continuous --checkPointTimes=30,60,120,300,600,900,1800,3600,7200 --logPath=November2/continuous/density=HIGH_nInventory=20_nHours=5_seed=10.json/mip.log
Loading problem instance...
Set parameter WLSAccessID
Set parameter WLSSecret
Set parameter LicenseID to value 2736771

> Task :runMipSolver FAILED
2 actionable tasks: 1 executed, 1 up-to-date

Command 15 FAILED (Duration: 5.10s)

[16/33] Starting command 16...
Executing: ./gradlew runMipSolver -PinstancePath="instances/1.json" -PoutputPath="November2/continuous" -PmodelType="Continuous" -PcheckPointTimes="30,60,120,300,600,900,1800,3600,7200" -PlogPath="November2/continuous/1.json/mip.log"
Command failed with return code: 1
Error: 
FAILURE: Build failed with an exception.

* What went wrong:
Execution failed for task ':runMipSolver'.
> Process 'command '/cta/users/erhun.kundakcioglu/jdk-21.0.3+9/bin/java'' finished with non-zero exit value 1

* Try:
> Run with --stacktrace option to get the stack trace.
> Run with --info or --debug option to get more log output.
> Run with --scan to get full insights.
> Get more help at https://help.gradle.org.

BUİLD FAILED in 4s

> Task :compileJava UP-TO-DATE
> Task :processResources NO-SOURCE
> Task :classes UP-TO-DATE

> Task :runMipSolver
Running MIP Solver with arguments: --instancePath=instances/1.json --outputPath=November2/continuous --modelType=Continuous --checkPointTimes=30,60,120,300,600,900,1800,3600,7200 --logPath=November2/continuous/1.json/mip.log
Loading problem instance...
Set parameter WLSAccessID
Set parameter WLSSecret
Set parameter LicenseID to value 2736771

> Task :runMipSolver FAILED
2 actionable tasks: 1 executed, 1 up-to-date

Command 16 FAILED (Duration: 4.96s)

[17/33] Starting command 17...
Executing: ./gradlew runMipSolver -PinstancePath="instances/density=MEDIUM_nInventory=20_nHours=5_seed=2.json" -PoutputPath="November2/continuous" -PmodelType="Continuous" -PcheckPointTimes="30,60,120,300,600,900,1800,3600,7200" -PlogPath="November2/continuous/density=MEDIUM_nInventory=20_nHours=5_seed=2.json/mip.log"
Command failed with return code: 1
Error: 
FAILURE: Build failed with an exception.

* What went wrong:
Execution failed for task ':runMipSolver'.
> Process 'command '/cta/users/erhun.kundakcioglu/jdk-21.0.3+9/bin/java'' finished with non-zero exit value 1

* Try:
> Run with --stacktrace option to get the stack trace.
> Run with --info or --debug option to get more log output.
> Run with --scan to get full insights.
> Get more help at https://help.gradle.org.

BUİLD FAILED in 4s

> Task :compileJava UP-TO-DATE
> Task :processResources NO-SOURCE
> Task :classes UP-TO-DATE

> Task :runMipSolver
Running MIP Solver with arguments: --instancePath=instances/density=MEDIUM_nInventory=20_nHours=5_seed=2.json --outputPath=November2/continuous --modelType=Continuous --checkPointTimes=30,60,120,300,600,900,1800,3600,7200 --logPath=November2/continuous/density=MEDIUM_nInventory=20_nHours=5_seed=2.json/mip.log
Loading problem instance...
Set parameter WLSAccessID
Set parameter WLSSecret
Set parameter LicenseID to value 2736771

> Task :runMipSolver FAILED
2 actionable tasks: 1 executed, 1 up-to-date

Command 17 FAILED (Duration: 5.17s)

[18/33] Starting command 18...
Executing: ./gradlew runMipSolver -PinstancePath="instances/density=MEDIUM_nInventory=15_nHours=4_seed=2.json" -PoutputPath="November2/continuous" -PmodelType="Continuous" -PcheckPointTimes="30,60,120,300,600,900,1800,3600,7200" -PlogPath="November2/continuous/density=MEDIUM_nInventory=15_nHours=4_seed=2.json/mip.log"
Command failed with return code: 1
Error: 
FAILURE: Build failed with an exception.

* What went wrong:
Execution failed for task ':runMipSolver'.
> Process 'command '/cta/users/erhun.kundakcioglu/jdk-21.0.3+9/bin/java'' finished with non-zero exit value 1

* Try:
> Run with --stacktrace option to get the stack trace.
> Run with --info or --debug option to get more log output.
> Run with --scan to get full insights.
> Get more help at https://help.gradle.org.

BUİLD FAILED in 4s

> Task :compileJava UP-TO-DATE
> Task :processResources NO-SOURCE
> Task :classes UP-TO-DATE

> Task :runMipSolver
Running MIP Solver with arguments: --instancePath=instances/density=MEDIUM_nInventory=15_nHours=4_seed=2.json --outputPath=November2/continuous --modelType=Continuous --checkPointTimes=30,60,120,300,600,900,1800,3600,7200 --logPath=November2/continuous/density=MEDIUM_nInventory=15_nHours=4_seed=2.json/mip.log
Loading problem instance...
Set parameter WLSAccessID
Set parameter WLSSecret
Set parameter LicenseID to value 2736771

> Task :runMipSolver FAILED
2 actionable tasks: 1 executed, 1 up-to-date

Command 18 FAILED (Duration: 4.98s)

[19/33] Starting command 19...
Executing: ./gradlew runMipSolver -PinstancePath="instances/density=HIGH_nInventory=10_nHours=3_seed=9.json" -PoutputPath="November2/continuous" -PmodelType="Continuous" -PcheckPointTimes="30,60,120,300,600,900,1800,3600,7200" -PlogPath="November2/continuous/density=HIGH_nInventory=10_nHours=3_seed=9.json/mip.log"
Command failed with return code: 1
Error: 
FAILURE: Build failed with an exception.

* What went wrong:
Execution failed for task ':runMipSolver'.
> Process 'command '/cta/users/erhun.kundakcioglu/jdk-21.0.3+9/bin/java'' finished with non-zero exit value 1

* Try:
> Run with --stacktrace option to get the stack trace.
> Run with --info or --debug option to get more log output.
> Run with --scan to get full insights.
> Get more help at https://help.gradle.org.

BUİLD FAILED in 5s

> Task :compileJava UP-TO-DATE
> Task :processResources NO-SOURCE
> Task :classes UP-TO-DATE

> Task :runMipSolver
Running MIP Solver with arguments: --instancePath=instances/density=HIGH_nInventory=10_nHours=3_seed=9.json --outputPath=November2/continuous --modelType=Continuous --checkPointTimes=30,60,120,300,600,900,1800,3600,7200 --logPath=November2/continuous/density=HIGH_nInventory=10_nHours=3_seed=9.json/mip.log
Loading problem instance...
Set parameter WLSAccessID
Set parameter WLSSecret
Set parameter LicenseID to value 2736771

> Task :runMipSolver FAILED
2 actionable tasks: 1 executed, 1 up-to-date

Command 19 FAILED (Duration: 5.38s)

[20/33] Starting command 20...
Executing: ./gradlew runMipSolver -PinstancePath="instances/density=MEDIUM_nInventory=10_nHours=3_seed=2.json" -PoutputPath="November2/continuous" -PmodelType="Continuous" -PcheckPointTimes="30,60,120,300,600,900,1800,3600,7200" -PlogPath="November2/continuous/density=MEDIUM_nInventory=10_nHours=3_seed=2.json/mip.log"
Command failed with return code: 1
Error: 
FAILURE: Build failed with an exception.

* What went wrong:
Execution failed for task ':runMipSolver'.
> Process 'command '/cta/users/erhun.kundakcioglu/jdk-21.0.3+9/bin/java'' finished with non-zero exit value 1

* Try:
> Run with --stacktrace option to get the stack trace.
> Run with --info or --debug option to get more log output.
> Run with --scan to get full insights.
> Get more help at https://help.gradle.org.

BUİLD FAILED in 5s

> Task :compileJava UP-TO-DATE
> Task :processResources NO-SOURCE
> Task :classes UP-TO-DATE

> Task :runMipSolver
Running MIP Solver with arguments: --instancePath=instances/density=MEDIUM_nInventory=10_nHours=3_seed=2.json --outputPath=November2/continuous --modelType=Continuous --checkPointTimes=30,60,120,300,600,900,1800,3600,7200 --logPath=November2/continuous/density=MEDIUM_nInventory=10_nHours=3_seed=2.json/mip.log
Loading problem instance...
Set parameter WLSAccessID
Set parameter WLSSecret
Set parameter LicenseID to value 2736771

> Task :runMipSolver FAILED
2 actionable tasks: 1 executed, 1 up-to-date

Command 20 FAILED (Duration: 5.46s)

[21/33] Starting command 21...
Executing: ./gradlew runMipSolver -PinstancePath="instances/2.json" -PoutputPath="November2/continuous" -PmodelType="Continuous" -PcheckPointTimes="30,60,120,300,600,900,1800,3600,7200" -PlogPath="November2/continuous/2.json/mip.log"
Command failed with return code: 1
Error: 
FAILURE: Build failed with an exception.

* What went wrong:
Execution failed for task ':runMipSolver'.
> Process 'command '/cta/users/erhun.kundakcioglu/jdk-21.0.3+9/bin/java'' finished with non-zero exit value 1

* Try:
> Run with --stacktrace option to get the stack trace.
> Run with --info or --debug option to get more log output.
> Run with --scan to get full insights.
> Get more help at https://help.gradle.org.

BUİLD FAILED in 4s

> Task :compileJava UP-TO-DATE
> Task :processResources NO-SOURCE
> Task :classes UP-TO-DATE

> Task :runMipSolver
Running MIP Solver with arguments: --instancePath=instances/2.json --outputPath=November2/continuous --modelType=Continuous --checkPointTimes=30,60,120,300,600,900,1800,3600,7200 --logPath=November2/continuous/2.json/mip.log
Loading problem instance...
Set parameter WLSAccessID
Set parameter WLSSecret
Set parameter LicenseID to value 2736771

> Task :runMipSolver FAILED
2 actionable tasks: 1 executed, 1 up-to-date

Command 21 FAILED (Duration: 4.99s)

[22/33] Starting command 22...
Executing: ./gradlew runMipSolver -PinstancePath="instances/density=HIGH_nInventory=15_nHours=4_seed=9.json" -PoutputPath="November2/continuous" -PmodelType="Continuous" -PcheckPointTimes="30,60,120,300,600,900,1800,3600,7200" -PlogPath="November2/continuous/density=HIGH_nInventory=15_nHours=4_seed=9.json/mip.log"
Command failed with return code: 1
Error: 
FAILURE: Build failed with an exception.

* What went wrong:
Execution failed for task ':runMipSolver'.
> Process 'command '/cta/users/erhun.kundakcioglu/jdk-21.0.3+9/bin/java'' finished with non-zero exit value 1

* Try:
> Run with --stacktrace option to get the stack trace.
> Run with --info or --debug option to get more log output.
> Run with --scan to get full insights.
> Get more help at https://help.gradle.org.

BUİLD FAILED in 4s

> Task :compileJava UP-TO-DATE
> Task :processResources NO-SOURCE
> Task :classes UP-TO-DATE

> Task :runMipSolver
Running MIP Solver with arguments: --instancePath=instances/density=HIGH_nInventory=15_nHours=4_seed=9.json --outputPath=November2/continuous --modelType=Continuous --checkPointTimes=30,60,120,300,600,900,1800,3600,7200 --logPath=November2/continuous/density=HIGH_nInventory=15_nHours=4_seed=9.json/mip.log
Loading problem instance...
Set parameter WLSAccessID
Set parameter WLSSecret
Set parameter LicenseID to value 2736771

> Task :runMipSolver FAILED
2 actionable tasks: 1 executed, 1 up-to-date

Command 22 FAILED (Duration: 5.18s)

[23/33] Starting command 23...
Executing: ./gradlew runMipSolver -PinstancePath="instances/density=MEDIUM_nInventory=20_nHours=5_seed=1.json" -PoutputPath="November2/continuous" -PmodelType="Continuous" -PcheckPointTimes="30,60,120,300,600,900,1800,3600,7200" -PlogPath="November2/continuous/density=MEDIUM_nInventory=20_nHours=5_seed=1.json/mip.log"
Command failed with return code: 1
Error: 
FAILURE: Build failed with an exception.

* What went wrong:
Execution failed for task ':runMipSolver'.
> Process 'command '/cta/users/erhun.kundakcioglu/jdk-21.0.3+9/bin/java'' finished with non-zero exit value 1

* Try:
> Run with --stacktrace option to get the stack trace.
> Run with --info or --debug option to get more log output.
> Run with --scan to get full insights.
> Get more help at https://help.gradle.org.

BUİLD FAILED in 4s

> Task :compileJava UP-TO-DATE
> Task :processResources NO-SOURCE
> Task :classes UP-TO-DATE

> Task :runMipSolver
Running MIP Solver with arguments: --instancePath=instances/density=MEDIUM_nInventory=20_nHours=5_seed=1.json --outputPath=November2/continuous --modelType=Continuous --checkPointTimes=30,60,120,300,600,900,1800,3600,7200 --logPath=November2/continuous/density=MEDIUM_nInventory=20_nHours=5_seed=1.json/mip.log
Loading problem instance...
Set parameter WLSAccessID
Set parameter WLSSecret
Set parameter LicenseID to value 2736771

> Task :runMipSolver FAILED
2 actionable tasks: 1 executed, 1 up-to-date

Command 23 FAILED (Duration: 4.82s)

[24/33] Starting command 24...
Executing: ./gradlew runMipSolver -PinstancePath="instances/density=HIGH_nInventory=20_nHours=5_seed=9.json" -PoutputPath="November2/continuous" -PmodelType="Continuous" -PcheckPointTimes="30,60,120,300,600,900,1800,3600,7200" -PlogPath="November2/continuous/density=HIGH_nInventory=20_nHours=5_seed=9.json/mip.log"
Command failed with return code: 1
Error: 
FAILURE: Build failed with an exception.

* What went wrong:
Execution failed for task ':runMipSolver'.
> Process 'command '/cta/users/erhun.kundakcioglu/jdk-21.0.3+9/bin/java'' finished with non-zero exit value 1

* Try:
> Run with --stacktrace option to get the stack trace.
> Run with --info or --debug option to get more log output.
> Run with --scan to get full insights.
> Get more help at https://help.gradle.org.

BUİLD FAILED in 4s

> Task :compileJava UP-TO-DATE
> Task :processResources NO-SOURCE
> Task :classes UP-TO-DATE

> Task :runMipSolver
Running MIP Solver with arguments: --instancePath=instances/density=HIGH_nInventory=20_nHours=5_seed=9.json --outputPath=November2/continuous --modelType=Continuous --checkPointTimes=30,60,120,300,600,900,1800,3600,7200 --logPath=November2/continuous/density=HIGH_nInventory=20_nHours=5_seed=9.json/mip.log
Loading problem instance...
Set parameter WLSAccessID
Set parameter WLSSecret
Set parameter LicenseID to value 2736771

> Task :runMipSolver FAILED
2 actionable tasks: 1 executed, 1 up-to-date

Command 24 FAILED (Duration: 5.18s)

[25/33] Starting command 25...
Executing: ./gradlew runMipSolver -PinstancePath="instances/density=MEDIUM_nInventory=15_nHours=4_seed=1.json" -PoutputPath="November2/continuous" -PmodelType="Continuous" -PcheckPointTimes="30,60,120,300,600,900,1800,3600,7200" -PlogPath="November2/continuous/density=MEDIUM_nInventory=15_nHours=4_seed=1.json/mip.log"
Command failed with return code: 1
Error: 
FAILURE: Build failed with an exception.

* What went wrong:
Execution failed for task ':runMipSolver'.
> Process 'command '/cta/users/erhun.kundakcioglu/jdk-21.0.3+9/bin/java'' finished with non-zero exit value 1

* Try:
> Run with --stacktrace option to get the stack trace.
> Run with --info or --debug option to get more log output.
> Run with --scan to get full insights.
> Get more help at https://help.gradle.org.

BUİLD FAILED in 4s

> Task :compileJava UP-TO-DATE
> Task :processResources NO-SOURCE
> Task :classes UP-TO-DATE

> Task :runMipSolver
Running MIP Solver with arguments: --instancePath=instances/density=MEDIUM_nInventory=15_nHours=4_seed=1.json --outputPath=November2/continuous --modelType=Continuous --checkPointTimes=30,60,120,300,600,900,1800,3600,7200 --logPath=November2/continuous/density=MEDIUM_nInventory=15_nHours=4_seed=1.json/mip.log
Loading problem instance...
Set parameter WLSAccessID
Set parameter WLSSecret
Set parameter LicenseID to value 2736771

> Task :runMipSolver FAILED
2 actionable tasks: 1 executed, 1 up-to-date

Command 25 FAILED (Duration: 5.10s)

[26/33] Starting command 26...
Executing: ./gradlew runMipSolver -PinstancePath="instances/density=LOW_nInventory=10_nHours=3_seed=3.json" -PoutputPath="November2/continuous" -PmodelType="Continuous" -PcheckPointTimes="30,60,120,300,600,900,1800,3600,7200" -PlogPath="November2/continuous/density=LOW_nInventory=10_nHours=3_seed=3.json/mip.log"
Command failed with return code: 1
Error: 
FAILURE: Build failed with an exception.

* What went wrong:
Execution failed for task ':runMipSolver'.
> Process 'command '/cta/users/erhun.kundakcioglu/jdk-21.0.3+9/bin/java'' finished with non-zero exit value 1

* Try:
> Run with --stacktrace option to get the stack trace.
> Run with --info or --debug option to get more log output.
> Run with --scan to get full insights.
> Get more help at https://help.gradle.org.

BUİLD FAILED in 4s

> Task :compileJava UP-TO-DATE
> Task :processResources NO-SOURCE
> Task :classes UP-TO-DATE

> Task :runMipSolver
Running MIP Solver with arguments: --instancePath=instances/density=LOW_nInventory=10_nHours=3_seed=3.json --outputPath=November2/continuous --modelType=Continuous --checkPointTimes=30,60,120,300,600,900,1800,3600,7200 --logPath=November2/continuous/density=LOW_nInventory=10_nHours=3_seed=3.json/mip.log
Loading problem instance...
Set parameter WLSAccessID
Set parameter WLSSecret
Set parameter LicenseID to value 2736771

> Task :runMipSolver FAILED
2 actionable tasks: 1 executed, 1 up-to-date

Command 26 FAILED (Duration: 4.92s)

[27/33] Starting command 27...
Executing: ./gradlew runMipSolver -PinstancePath="instances/density=HIGH_nInventory=15_nHours=4_seed=5.json" -PoutputPath="November2/continuous" -PmodelType="Continuous" -PcheckPointTimes="30,60,120,300,600,900,1800,3600,7200" -PlogPath="November2/continuous/density=HIGH_nInventory=15_nHours=4_seed=5.json/mip.log"
Command failed with return code: 1
Error: 
FAILURE: Build failed with an exception.

* What went wrong:
Execution failed for task ':runMipSolver'.
> Process 'command '/cta/users/erhun.kundakcioglu/jdk-21.0.3+9/bin/java'' finished with non-zero exit value 1

* Try:
> Run with --stacktrace option to get the stack trace.
> Run with --info or --debug option to get more log output.
> Run with --scan to get full insights.
> Get more help at https://help.gradle.org.

BUİLD FAILED in 4s

> Task :compileJava UP-TO-DATE
> Task :processResources NO-SOURCE
> Task :classes UP-TO-DATE

> Task :runMipSolver
Running MIP Solver with arguments: --instancePath=instances/density=HIGH_nInventory=15_nHours=4_seed=5.json --outputPath=November2/continuous --modelType=Continuous --checkPointTimes=30,60,120,300,600,900,1800,3600,7200 --logPath=November2/continuous/density=HIGH_nInventory=15_nHours=4_seed=5.json/mip.log
Loading problem instance...
Set parameter WLSAccessID
Set parameter WLSSecret
Set parameter LicenseID to value 2736771

> Task :runMipSolver FAILED
2 actionable tasks: 1 executed, 1 up-to-date

Command 27 FAILED (Duration: 5.03s)

[28/33] Starting command 28...
Executing: ./gradlew runMipSolver -PinstancePath="instances/density=HIGH_nInventory=20_nHours=5_seed=5.json" -PoutputPath="November2/continuous" -PmodelType="Continuous" -PcheckPointTimes="30,60,120,300,600,900,1800,3600,7200" -PlogPath="November2/continuous/density=HIGH_nInventory=20_nHours=5_seed=5.json/mip.log"
Command failed with return code: 1
Error: 
FAILURE: Build failed with an exception.

* What went wrong:
Execution failed for task ':runMipSolver'.
> Process 'command '/cta/users/erhun.kundakcioglu/jdk-21.0.3+9/bin/java'' finished with non-zero exit value 1

* Try:
> Run with --stacktrace option to get the stack trace.
> Run with --info or --debug option to get more log output.
> Run with --scan to get full insights.
> Get more help at https://help.gradle.org.

BUİLD FAILED in 4s

> Task :compileJava UP-TO-DATE
> Task :processResources NO-SOURCE
> Task :classes UP-TO-DATE

> Task :runMipSolver
Running MIP Solver with arguments: --instancePath=instances/density=HIGH_nInventory=20_nHours=5_seed=5.json --outputPath=November2/continuous --modelType=Continuous --checkPointTimes=30,60,120,300,600,900,1800,3600,7200 --logPath=November2/continuous/density=HIGH_nInventory=20_nHours=5_seed=5.json/mip.log
Loading problem instance...
Set parameter WLSAccessID
Set parameter WLSSecret
Set parameter LicenseID to value 2736771

> Task :runMipSolver FAILED
2 actionable tasks: 1 executed, 1 up-to-date

Command 28 FAILED (Duration: 5.04s)

[29/33] Starting command 29...
Executing: ./gradlew runMipSolver -PinstancePath="instances/density=HIGH_nInventory=10_nHours=3_seed=6.json" -PoutputPath="November2/continuous" -PmodelType="Continuous" -PcheckPointTimes="30,60,120,300,600,900,1800,3600,7200" -PlogPath="November2/continuous/density=HIGH_nInventory=10_nHours=3_seed=6.json/mip.log"
Command failed with return code: 1
Error: 
FAILURE: Build failed with an exception.

* What went wrong:
Execution failed for task ':runMipSolver'.
> Process 'command '/cta/users/erhun.kundakcioglu/jdk-21.0.3+9/bin/java'' finished with non-zero exit value 1

* Try:
> Run with --stacktrace option to get the stack trace.
> Run with --info or --debug option to get more log output.
> Run with --scan to get full insights.
> Get more help at https://help.gradle.org.

BUİLD FAILED in 4s

> Task :compileJava UP-TO-DATE
> Task :processResources NO-SOURCE
> Task :classes UP-TO-DATE

> Task :runMipSolver
Running MIP Solver with arguments: --instancePath=instances/density=HIGH_nInventory=10_nHours=3_seed=6.json --outputPath=November2/continuous --modelType=Continuous --checkPointTimes=30,60,120,300,600,900,1800,3600,7200 --logPath=November2/continuous/density=HIGH_nInventory=10_nHours=3_seed=6.json/mip.log
Loading problem instance...
Set parameter WLSAccessID
Set parameter WLSSecret
Set parameter LicenseID to value 2736771

> Task :runMipSolver FAILED
2 actionable tasks: 1 executed, 1 up-to-date

Command 29 FAILED (Duration: 5.23s)

[30/33] Starting command 30...
Executing: ./gradlew runMipSolver -PinstancePath="instances/density=HIGH_nInventory=10_nHours=3_seed=7.json" -PoutputPath="November2/continuous" -PmodelType="Continuous" -PcheckPointTimes="30,60,120,300,600,900,1800,3600,7200" -PlogPath="November2/continuous/density=HIGH_nInventory=10_nHours=3_seed=7.json/mip.log"
Command failed with return code: 1
Error: 
FAILURE: Build failed with an exception.

* What went wrong:
Execution failed for task ':runMipSolver'.
> Process 'command '/cta/users/erhun.kundakcioglu/jdk-21.0.3+9/bin/java'' finished with non-zero exit value 1

* Try:
> Run with --stacktrace option to get the stack trace.
> Run with --info or --debug option to get more log output.
> Run with --scan to get full insights.
> Get more help at https://help.gradle.org.

BUİLD FAILED in 4s

> Task :compileJava UP-TO-DATE
> Task :processResources NO-SOURCE
> Task :classes UP-TO-DATE

> Task :runMipSolver
Running MIP Solver with arguments: --instancePath=instances/density=HIGH_nInventory=10_nHours=3_seed=7.json --outputPath=November2/continuous --modelType=Continuous --checkPointTimes=30,60,120,300,600,900,1800,3600,7200 --logPath=November2/continuous/density=HIGH_nInventory=10_nHours=3_seed=7.json/mip.log
Loading problem instance...
Set parameter WLSAccessID
Set parameter WLSSecret
Set parameter LicenseID to value 2736771

> Task :runMipSolver FAILED
2 actionable tasks: 1 executed, 1 up-to-date

Command 30 FAILED (Duration: 5.01s)

[31/33] Starting command 31...
Executing: ./gradlew runMipSolver -PinstancePath="instances/density=LOW_nInventory=15_nHours=4_seed=1.json" -PoutputPath="November2/continuous" -PmodelType="Continuous" -PcheckPointTimes="30,60,120,300,600,900,1800,3600,7200" -PlogPath="November2/continuous/density=LOW_nInventory=15_nHours=4_seed=1.json/mip.log"
Command failed with return code: 1
Error: 
FAILURE: Build failed with an exception.

* What went wrong:
Execution failed for task ':runMipSolver'.
> Process 'command '/cta/users/erhun.kundakcioglu/jdk-21.0.3+9/bin/java'' finished with non-zero exit value 1

* Try:
> Run with --stacktrace option to get the stack trace.
> Run with --info or --debug option to get more log output.
> Run with --scan to get full insights.
> Get more help at https://help.gradle.org.

BUİLD FAILED in 4s

> Task :compileJava UP-TO-DATE
> Task :processResources NO-SOURCE
> Task :classes UP-TO-DATE

> Task :runMipSolver
Running MIP Solver with arguments: --instancePath=instances/density=LOW_nInventory=15_nHours=4_seed=1.json --outputPath=November2/continuous --modelType=Continuous --checkPointTimes=30,60,120,300,600,900,1800,3600,7200 --logPath=November2/continuous/density=LOW_nInventory=15_nHours=4_seed=1.json/mip.log
Loading problem instance...
Set parameter WLSAccessID
Set parameter WLSSecret
Set parameter LicenseID to value 2736771

> Task :runMipSolver FAILED
2 actionable tasks: 1 executed, 1 up-to-date

Command 31 FAILED (Duration: 5.11s)

[32/33] Starting command 32...
Executing: ./gradlew runMipSolver -PinstancePath="instances/density=HIGH_nInventory=20_nHours=5_seed=4.json" -PoutputPath="November2/continuous" -PmodelType="Continuous" -PcheckPointTimes="30,60,120,300,600,900,1800,3600,7200" -PlogPath="November2/continuous/density=HIGH_nInventory=20_nHours=5_seed=4.json/mip.log"
Command failed with return code: 1
Error: 
FAILURE: Build failed with an exception.

* What went wrong:
Execution failed for task ':runMipSolver'.
> Process 'command '/cta/users/erhun.kundakcioglu/jdk-21.0.3+9/bin/java'' finished with non-zero exit value 1

* Try:
> Run with --stacktrace option to get the stack trace.
> Run with --info or --debug option to get more log output.
> Run with --scan to get full insights.
> Get more help at https://help.gradle.org.

BUİLD FAILED in 4s

> Task :compileJava UP-TO-DATE
> Task :processResources NO-SOURCE
> Task :classes UP-TO-DATE

> Task :runMipSolver
Running MIP Solver with arguments: --instancePath=instances/density=HIGH_nInventory=20_nHours=5_seed=4.json --outputPath=November2/continuous --modelType=Continuous --checkPointTimes=30,60,120,300,600,900,1800,3600,7200 --logPath=November2/continuous/density=HIGH_nInventory=20_nHours=5_seed=4.json/mip.log
Loading problem instance...
Set parameter WLSAccessID
Set parameter WLSSecret
Set parameter LicenseID to value 2736771

> Task :runMipSolver FAILED
2 actionable tasks: 1 executed, 1 up-to-date

Command 32 FAILED (Duration: 5.25s)

[33/33] Starting command 33...
Executing: ./gradlew runMipSolver -PinstancePath="instances/density=LOW_nInventory=20_nHours=5_seed=1.json" -PoutputPath="November2/continuous" -PmodelType="Continuous" -PcheckPointTimes="30,60,120,300,600,900,1800,3600,7200" -PlogPath="November2/continuous/density=LOW_nInventory=20_nHours=5_seed=1.json/mip.log"
Command failed with return code: 1
Error: 
FAILURE: Build failed with an exception.

* What went wrong:
Execution failed for task ':runMipSolver'.
> Process 'command '/cta/users/erhun.kundakcioglu/jdk-21.0.3+9/bin/java'' finished with non-zero exit value 1

* Try:
> Run with --stacktrace option to get the stack trace.
> Run with --info or --debug option to get more log output.
> Run with --scan to get full insights.
> Get more help at https://help.gradle.org.

BUİLD FAILED in 4s

> Task :compileJava UP-TO-DATE
> Task :processResources NO-SOURCE
> Task :classes UP-TO-DATE

> Task :runMipSolver
Running MIP Solver with arguments: --instancePath=instances/density=LOW_nInventory=20_nHours=5_seed=1.json --outputPath=November2/continuous --modelType=Continuous --checkPointTimes=30,60,120,300,600,900,1800,3600,7200 --logPath=November2/continuous/density=LOW_nInventory=20_nHours=5_seed=1.json/mip.log
Loading problem instance...
Set parameter WLSAccessID
Set parameter WLSSecret
Set parameter LicenseID to value 2736771

> Task :runMipSolver FAILED
2 actionable tasks: 1 executed, 1 up-to-date

Command 33 FAILED (Duration: 4.59s)

================================================================================
Execution Summary:
Total commands: 33
Executed: 33
Successful: 0
Failed: 33
Total duration: 1076.73s
Average duration per command: 32.63s
[INFO] Done.
[INFO] SLURM job 152942 finished at Sun Nov 30 10:42:50 +03 2025

=== HUMAN SUMMARY ===
CPU: 3.7 GHz Intel(R) Xeon(R) Gold 6130 CPU @ 2.10GHz (32-logical)  RAM: 251Gi  GPU: none

